{
  "$schema": "https://json-schema.org/draft/2020-12/schema",
  "title": "chart_impact.json",
  "type": "object",
  "required": ["resolver_summary", "seed_modules", "impacted_charts", "cycles", "build_order"],
  "additionalProperties": false,
  "properties": {
    "resolver_summary": {
      "type": "object",
      "required": ["selected_total", "missing", "conflicts", "cycle_group_count"],
      "additionalProperties": false,
      "properties": {
        "selected_total":     {"type": "integer", "minimum": 0},
        "missing":            {"type": "array", "items": {"type": "string"}},
        "conflicts":          {"type": "array", "items": {"type": "string"}},
        "cycle_group_count":  {"type": "integer", "minimum": 0}
      }
    },
    "seed_modules": {
      "type": "array",
      "items": {
        "type": "object",
        "required": ["workload_ref", "chart", "version"],
        "additionalProperties": false,
        "properties": {
          "workload_ref": {"type": "string"},
          "chart":        {"type": "string"},
          "version":      {"type": "string"}
        }
      }
    },
    "impacted_charts": {
      "type": "array",
      "items": {
        "type": "object",
        "required": ["name", "version", "triggered_by"],
        "additionalProperties": false,
        "properties": {
          "name":         {"type": "string"},
          "version":      {"type": "string"},
          "triggered_by": {"type": "array", "items": {"type": "string"}}
        }
      }
    },
    "cycles": {
      "type": "array",
      "items": {"type": "array", "items": {"type": "string"}}
    },
    "build_order": {
      "type": "array",
      "items": {"type": "array", "items": {"type": "string"}}
    }
  }
}
